{
  "correlation_id": "95a0b32d-7620-4eaa-9e15-e8f874ad717a",
  "summary": "Identified 4 key requirements from the source.",
  "requirements": [
    {
      "id": "REQ-001",
      "statement": "The administration portal must restrict configuration changes to authorized administrators",
      "rationale": "Identified directly from the supplied source",
      "category": "Security",
      "priority": "High",
      "source_locations": [
        "Text block 1"
      ]
    },
    {
      "id": "REQ-002",
      "statement": "Every configuration change must be written to an audit log with the user, timestamp, previous value, and new value",
      "rationale": "Identified directly from the supplied source",
      "category": "Security",
      "priority": "High",
      "source_locations": [
        "Text block 1"
      ]
    },
    {
      "id": "REQ-003",
      "statement": "The system should alert the operations team after five failed sign-in attempts for the same account within ten minutes",
      "rationale": "Identified directly from the supplied source",
      "category": "Reliability",
      "priority": "Medium",
      "source_locations": [
        "Text block 2"
      ]
    },
    {
      "id": "REQ-004",
      "statement": "Audit records must be retained for one year and must not contain access tokens or passwords",
      "rationale": "Identified directly from the supplied source",
      "category": "Security",
      "priority": "High",
      "source_locations": [
        "Text block 2"
      ]
    }
  ],
  "key_requirements": [
    "The administration portal must restrict configuration changes to authorized administrators",
    "Every configuration change must be written to an audit log with the user, timestamp, previous value, and new value",
    "The system should alert the operations team after five failed sign-in attempts for the same account within ten minutes",
    "Audit records must be retained for one year and must not contain access tokens or passwords"
  ],
  "stories": [
    {
      "id": "STORY-001",
      "title": "The administration portal must restrict configuration changes to authorized administrators",
      "description": "As an engineering team, we want the product to satisfy this requirement: The administration portal must restrict configuration changes to authorized administrators, so that the identified user or operational need is addressed.",
      "acceptance_criteria": [
        "Given the required inputs are available, when the feature is used, then it satisfies: The administration portal must restrict configuration changes to authorized administrators.",
        "Errors are reported clearly without producing partial results."
      ],
      "priority": "High",
      "category": "Security",
      "requirement_ids": [
        "REQ-001"
      ],
      "related_backlog_ids": [],
      "backlog_relationships": [],
      "recommended_action": "create_new"
    },
    {
      "id": "STORY-002",
      "title": "Every configuration change must be written to an audit log with the user, timestamp,...",
      "description": "As an engineering team, we want the product to satisfy this requirement: Every configuration change must be written to an audit log with the user, timestamp, previous value, and new value, so that the identified user or operational need is addressed.",
      "acceptance_criteria": [
        "Given the required inputs are available, when the feature is used, then it satisfies: Every configuration change must be written to an audit log with the user, timestamp, previous value, and new value.",
        "Errors are reported clearly without producing partial results."
      ],
      "priority": "High",
      "category": "Security",
      "requirement_ids": [
        "REQ-002"
      ],
      "related_backlog_ids": [],
      "backlog_relationships": [],
      "recommended_action": "create_new"
    },
    {
      "id": "STORY-003",
      "title": "The system should alert the operations team after five failed sign-in attempts for the...",
      "description": "As an engineering team, we want the product to satisfy this requirement: The system should alert the operations team after five failed sign-in attempts for the same account within ten minutes, so that the identified user or operational need is addressed.",
      "acceptance_criteria": [
        "Given the required inputs are available, when the feature is used, then it satisfies: The system should alert the operations team after five failed sign-in attempts for the same account within ten minutes.",
        "Errors are reported clearly without producing partial results."
      ],
      "priority": "Medium",
      "category": "Reliability",
      "requirement_ids": [
        "REQ-003"
      ],
      "related_backlog_ids": [],
      "backlog_relationships": [],
      "recommended_action": "create_new"
    },
    {
      "id": "STORY-004",
      "title": "Audit records must be retained for one year and must not contain access tokens or...",
      "description": "As an engineering team, we want the product to satisfy this requirement: Audit records must be retained for one year and must not contain access tokens or passwords, so that the identified user or operational need is addressed.",
      "acceptance_criteria": [
        "Given the required inputs are available, when the feature is used, then it satisfies: Audit records must be retained for one year and must not contain access tokens or passwords.",
        "Errors are reported clearly without producing partial results."
      ],
      "priority": "High",
      "category": "Security",
      "requirement_ids": [
        "REQ-004"
      ],
      "related_backlog_ids": [],
      "backlog_relationships": [],
      "recommended_action": "create_new"
    }
  ],
  "assumptions": [],
  "review_notes": [
    "Proposal passed deterministic structure checks."
  ],
  "approval_required": true,
  "tool_invocations": [
    {
      "correlation_id": "95a0b32d-7620-4eaa-9e15-e8f874ad717a",
      "agent": "Orchestrator Agent",
      "tool": "request_inspection",
      "call_count": 1,
      "execution": "fallback"
    },
    {
      "correlation_id": "95a0b32d-7620-4eaa-9e15-e8f874ad717a",
      "agent": "Requirements Analyst Agent",
      "tool": "source_reader",
      "call_count": 1,
      "execution": "fallback"
    },
    {
      "correlation_id": "95a0b32d-7620-4eaa-9e15-e8f874ad717a",
      "agent": "Backlog Analyst Agent",
      "tool": "backlog_search",
      "call_count": 1,
      "execution": "fallback"
    },
    {
      "correlation_id": "95a0b32d-7620-4eaa-9e15-e8f874ad717a",
      "agent": "Story Writer Agent",
      "tool": "story_context",
      "call_count": 1,
      "execution": "fallback"
    },
    {
      "correlation_id": "95a0b32d-7620-4eaa-9e15-e8f874ad717a",
      "agent": "Quality Reviewer Agent",
      "tool": "proposal_validation",
      "call_count": 1,
      "execution": "fallback"
    }
  ]
}