{
  "correlation_id": "b5bd6c41-cebc-4f47-b950-dce173bbb22a",
  "summary": "Identified 3 key requirements from the source.",
  "requirements": [
    {
      "id": "REQ-001",
      "statement": "Extend the existing Inventory Application Angular 15 upgrade to include automated bundle-size analysis, WCAG accessibility checks, and Node.js 20 build compatibility",
      "rationale": "Identified directly from the supplied source",
      "category": "Application Modernization",
      "priority": "Medium",
      "source_locations": []
    },
    {
      "id": "REQ-002",
      "statement": "The build should fail when the production bundle exceeds the agreed size limit or when critical accessibility violations are detected",
      "rationale": "Identified directly from the supplied source",
      "category": "Security",
      "priority": "High",
      "source_locations": []
    },
    {
      "id": "REQ-003",
      "statement": "Existing inventory workflows must continue to pass regression testing",
      "rationale": "Identified directly from the supplied source",
      "category": "Testing",
      "priority": "High",
      "source_locations": []
    }
  ],
  "key_requirements": [
    "Extend the existing Inventory Application Angular 15 upgrade to include automated bundle-size analysis, WCAG accessibility checks, and Node.js 20 build compatibility",
    "The build should fail when the production bundle exceeds the agreed size limit or when critical accessibility violations are detected",
    "Existing inventory workflows must continue to pass regression testing"
  ],
  "stories": [
    {
      "id": "STORY-001",
      "title": "Extend the existing Inventory Application Angular 15 upgrade to include automated...",
      "description": "As an engineering team, we want the product to satisfy this requirement: Extend the existing Inventory Application Angular 15 upgrade to include automated bundle-size analysis, WCAG accessibility checks, and Node.js 20 build compatibility, so that the identified user or operational need is addressed.",
      "acceptance_criteria": [
        "Given the required inputs are available, when the feature is used, then it satisfies: Extend the existing Inventory Application Angular 15 upgrade to include automated bundle-size analysis, WCAG accessibility checks, and Node.js 20 build compatibility.",
        "Errors are reported clearly without producing partial results."
      ],
      "priority": "Medium",
      "category": "Application Modernization",
      "requirement_ids": [
        "REQ-001"
      ],
      "related_backlog_ids": [
        "BL-201"
      ],
      "backlog_relationships": [
        {
          "requirement_id": "REQ-001",
          "backlog_id": "BL-201",
          "relationship": "related",
          "rationale": "Token overlap score 0.29",
          "recommended_action": "extend_existing"
        }
      ],
      "recommended_action": "extend_existing"
    },
    {
      "id": "STORY-002",
      "title": "The build should fail when the production bundle exceeds the agreed size limit or when...",
      "description": "As an engineering team, we want the product to satisfy this requirement: The build should fail when the production bundle exceeds the agreed size limit or when critical accessibility violations are detected, so that the identified user or operational need is addressed.",
      "acceptance_criteria": [
        "Given the required inputs are available, when the feature is used, then it satisfies: The build should fail when the production bundle exceeds the agreed size limit or when critical accessibility violations are detected.",
        "Errors are reported clearly without producing partial results."
      ],
      "priority": "High",
      "category": "Security",
      "requirement_ids": [
        "REQ-002"
      ],
      "related_backlog_ids": [],
      "backlog_relationships": [],
      "recommended_action": "create_new"
    },
    {
      "id": "STORY-003",
      "title": "Existing inventory workflows must continue to pass regression testing",
      "description": "As an engineering team, we want the product to satisfy this requirement: Existing inventory workflows must continue to pass regression testing, so that the identified user or operational need is addressed.",
      "acceptance_criteria": [
        "Given the required inputs are available, when the feature is used, then it satisfies: Existing inventory workflows must continue to pass regression testing.",
        "Errors are reported clearly without producing partial results."
      ],
      "priority": "High",
      "category": "Testing",
      "requirement_ids": [
        "REQ-003"
      ],
      "related_backlog_ids": [
        "BL-201"
      ],
      "backlog_relationships": [
        {
          "requirement_id": "REQ-003",
          "backlog_id": "BL-201",
          "relationship": "related",
          "rationale": "Token overlap score 0.15",
          "recommended_action": "extend_existing"
        }
      ],
      "recommended_action": "extend_existing"
    }
  ],
  "assumptions": [],
  "review_notes": [
    "Proposal passed deterministic structure checks.",
    "AI output failed guardrails; a deterministic validated proposal was used."
  ],
  "approval_required": true,
  "tool_invocations": [
    {
      "correlation_id": "b5bd6c41-cebc-4f47-b950-dce173bbb22a",
      "agent": "Orchestrator Agent",
      "tool": "request_inspection",
      "call_count": 1,
      "execution": "model"
    },
    {
      "correlation_id": "b5bd6c41-cebc-4f47-b950-dce173bbb22a",
      "agent": "Requirements Analyst Agent",
      "tool": "source_reader",
      "call_count": 1,
      "execution": "model"
    },
    {
      "correlation_id": "b5bd6c41-cebc-4f47-b950-dce173bbb22a",
      "agent": "Backlog Analyst Agent",
      "tool": "backlog_search",
      "call_count": 1,
      "execution": "model"
    },
    {
      "correlation_id": "b5bd6c41-cebc-4f47-b950-dce173bbb22a",
      "agent": "Story Writer Agent",
      "tool": "story_context",
      "call_count": 1,
      "execution": "fallback"
    },
    {
      "correlation_id": "b5bd6c41-cebc-4f47-b950-dce173bbb22a",
      "agent": "Quality Reviewer Agent",
      "tool": "proposal_validation",
      "call_count": 1,
      "execution": "model"
    }
  ]
}