{
  "correlation_id": "2d2c93a8-6499-4848-8353-2057e24d6445",
  "summary": "Identified 5 key requirements from the source.",
  "requirements": [
    {
      "id": "REQ-001",
      "statement": "Create an automated build and release pipeline for the Inventory Application",
      "rationale": "Identified directly from the supplied source",
      "category": "DevOps",
      "priority": "Medium",
      "source_locations": []
    },
    {
      "id": "REQ-002",
      "statement": "Every source change must restore dependencies, build the Angular application, run unit and integration tests, and publish a versioned deployment artifact",
      "rationale": "Identified directly from the supplied source",
      "category": "Application Modernization",
      "priority": "High",
      "source_locations": []
    },
    {
      "id": "REQ-003",
      "statement": "Test failures must stop the pipeline",
      "rationale": "Identified directly from the supplied source",
      "category": "DevOps",
      "priority": "High",
      "source_locations": []
    },
    {
      "id": "REQ-004",
      "statement": "The release process must deploy the same approved artifact to development, test, and production",
      "rationale": "Identified directly from the supplied source",
      "category": "DevOps",
      "priority": "High",
      "source_locations": []
    },
    {
      "id": "REQ-005",
      "statement": "Production deployment must require approval and retain the deployment history",
      "rationale": "Identified directly from the supplied source",
      "category": "DevOps",
      "priority": "High",
      "source_locations": []
    }
  ],
  "key_requirements": [
    "Create an automated build and release pipeline for the Inventory Application",
    "Every source change must restore dependencies, build the Angular application, run unit and integration tests, and publish a versioned deployment artifact",
    "Test failures must stop the pipeline",
    "The release process must deploy the same approved artifact to development, test, and production",
    "Production deployment must require approval and retain the deployment history"
  ],
  "stories": [
    {
      "id": "STORY-001",
      "title": "Create an automated build and release pipeline for the Inventory Application",
      "description": "As an engineering team, we want the product to satisfy this requirement: Create an automated build and release pipeline for the Inventory Application, so that the identified user or operational need is addressed.",
      "acceptance_criteria": [
        "Given the required inputs are available, when the feature is used, then it satisfies: Create an automated build and release pipeline for the Inventory Application.",
        "Errors are reported clearly without producing partial results."
      ],
      "priority": "Medium",
      "category": "DevOps",
      "requirement_ids": [
        "REQ-001"
      ],
      "related_backlog_ids": [],
      "backlog_relationships": [],
      "recommended_action": "create_new"
    },
    {
      "id": "STORY-002",
      "title": "Every source change must restore dependencies, build the Angular application, run unit...",
      "description": "As an engineering team, we want the product to satisfy this requirement: Every source change must restore dependencies, build the Angular application, run unit and integration tests, and publish a versioned deployment artifact, so that the identified user or operational need is addressed.",
      "acceptance_criteria": [
        "Given the required inputs are available, when the feature is used, then it satisfies: Every source change must restore dependencies, build the Angular application, run unit and integration tests, and publish a versioned deployment artifact.",
        "Errors are reported clearly without producing partial results."
      ],
      "priority": "High",
      "category": "Application Modernization",
      "requirement_ids": [
        "REQ-002"
      ],
      "related_backlog_ids": [],
      "backlog_relationships": [],
      "recommended_action": "create_new"
    },
    {
      "id": "STORY-003",
      "title": "Test failures must stop the pipeline",
      "description": "As an engineering team, we want the product to satisfy this requirement: Test failures must stop the pipeline, so that the identified user or operational need is addressed.",
      "acceptance_criteria": [
        "Given the required inputs are available, when the feature is used, then it satisfies: Test failures must stop the pipeline.",
        "Errors are reported clearly without producing partial results."
      ],
      "priority": "High",
      "category": "DevOps",
      "requirement_ids": [
        "REQ-003"
      ],
      "related_backlog_ids": [],
      "backlog_relationships": [],
      "recommended_action": "create_new"
    },
    {
      "id": "STORY-004",
      "title": "The release process must deploy the same approved artifact to development, test, and...",
      "description": "As an engineering team, we want the product to satisfy this requirement: The release process must deploy the same approved artifact to development, test, and production, so that the identified user or operational need is addressed.",
      "acceptance_criteria": [
        "Given the required inputs are available, when the feature is used, then it satisfies: The release process must deploy the same approved artifact to development, test, and production.",
        "Errors are reported clearly without producing partial results."
      ],
      "priority": "High",
      "category": "DevOps",
      "requirement_ids": [
        "REQ-004"
      ],
      "related_backlog_ids": [],
      "backlog_relationships": [],
      "recommended_action": "create_new"
    },
    {
      "id": "STORY-005",
      "title": "Production deployment must require approval and retain the deployment history",
      "description": "As an engineering team, we want the product to satisfy this requirement: Production deployment must require approval and retain the deployment history, so that the identified user or operational need is addressed.",
      "acceptance_criteria": [
        "Given the required inputs are available, when the feature is used, then it satisfies: Production deployment must require approval and retain the deployment history.",
        "Errors are reported clearly without producing partial results."
      ],
      "priority": "High",
      "category": "DevOps",
      "requirement_ids": [
        "REQ-005"
      ],
      "related_backlog_ids": [],
      "backlog_relationships": [],
      "recommended_action": "create_new"
    }
  ],
  "assumptions": [],
  "review_notes": [
    "Proposal passed deterministic structure checks.",
    "AI output failed guardrails; a deterministic validated proposal was used."
  ],
  "approval_required": true,
  "tool_invocations": [
    {
      "correlation_id": "2d2c93a8-6499-4848-8353-2057e24d6445",
      "agent": "Orchestrator Agent",
      "tool": "request_inspection",
      "call_count": 1,
      "execution": "model"
    },
    {
      "correlation_id": "2d2c93a8-6499-4848-8353-2057e24d6445",
      "agent": "Requirements Analyst Agent",
      "tool": "source_reader",
      "call_count": 1,
      "execution": "model"
    },
    {
      "correlation_id": "2d2c93a8-6499-4848-8353-2057e24d6445",
      "agent": "Backlog Analyst Agent",
      "tool": "backlog_search",
      "call_count": 1,
      "execution": "model"
    },
    {
      "correlation_id": "2d2c93a8-6499-4848-8353-2057e24d6445",
      "agent": "Story Writer Agent",
      "tool": "story_context",
      "call_count": 1,
      "execution": "fallback"
    },
    {
      "correlation_id": "2d2c93a8-6499-4848-8353-2057e24d6445",
      "agent": "Quality Reviewer Agent",
      "tool": "proposal_validation",
      "call_count": 1,
      "execution": "model"
    }
  ]
}