{
  "correlation_id": "da3d271f-7388-4fcb-b070-df39efbd183b",
  "summary": "Identified 5 key requirements from the source.",
  "requirements": [
    {
      "id": "REQ-001",
      "statement": "Engineering teams need a dashboard that summarizes deployment health across services",
      "rationale": "Identified directly from the supplied source",
      "category": "DevOps",
      "priority": "Medium",
      "source_locations": []
    },
    {
      "id": "REQ-002",
      "statement": "The dashboard should show the latest deployment status, active incidents, and failed health checks",
      "rationale": "Identified directly from the supplied source",
      "category": "DevOps",
      "priority": "Medium",
      "source_locations": []
    },
    {
      "id": "REQ-003",
      "statement": "Service owners should be able to filter by environment and owning team",
      "rationale": "Identified directly from the supplied source",
      "category": "Feature",
      "priority": "Medium",
      "source_locations": []
    },
    {
      "id": "REQ-004",
      "statement": "The dashboard should display current information within two minutes of a deployment event",
      "rationale": "Identified directly from the supplied source",
      "category": "DevOps",
      "priority": "Medium",
      "source_locations": []
    },
    {
      "id": "REQ-005",
      "statement": "If a data source is unavailable, the dashboard must show the source as unavailable instead of displaying stale data as current",
      "rationale": "Identified directly from the supplied source",
      "category": "Reliability",
      "priority": "High",
      "source_locations": []
    }
  ],
  "key_requirements": [
    "Engineering teams need a dashboard that summarizes deployment health across services",
    "The dashboard should show the latest deployment status, active incidents, and failed health checks",
    "Service owners should be able to filter by environment and owning team",
    "The dashboard should display current information within two minutes of a deployment event",
    "If a data source is unavailable, the dashboard must show the source as unavailable instead of displaying stale data as current"
  ],
  "stories": [
    {
      "id": "STORY-001",
      "title": "Engineering teams need a dashboard that summarizes deployment health across services",
      "description": "As an engineering team, we want the product to satisfy this requirement: Engineering teams need a dashboard that summarizes deployment health across services, so that the identified user or operational need is addressed.",
      "acceptance_criteria": [
        "Given the required inputs are available, when the feature is used, then it satisfies: Engineering teams need a dashboard that summarizes deployment health across services.",
        "Errors are reported clearly without producing partial results."
      ],
      "priority": "Medium",
      "category": "DevOps",
      "requirement_ids": [
        "REQ-001"
      ],
      "related_backlog_ids": [],
      "backlog_relationships": [],
      "recommended_action": "create_new"
    },
    {
      "id": "STORY-002",
      "title": "The dashboard should show the latest deployment status, active incidents, and failed...",
      "description": "As an engineering team, we want the product to satisfy this requirement: The dashboard should show the latest deployment status, active incidents, and failed health checks, so that the identified user or operational need is addressed.",
      "acceptance_criteria": [
        "Given the required inputs are available, when the feature is used, then it satisfies: The dashboard should show the latest deployment status, active incidents, and failed health checks.",
        "Errors are reported clearly without producing partial results."
      ],
      "priority": "Medium",
      "category": "DevOps",
      "requirement_ids": [
        "REQ-002"
      ],
      "related_backlog_ids": [],
      "backlog_relationships": [],
      "recommended_action": "create_new"
    },
    {
      "id": "STORY-003",
      "title": "Service owners should be able to filter by environment and owning team",
      "description": "As an engineering team, we want the product to satisfy this requirement: Service owners should be able to filter by environment and owning team, so that the identified user or operational need is addressed.",
      "acceptance_criteria": [
        "Given the required inputs are available, when the feature is used, then it satisfies: Service owners should be able to filter by environment and owning team.",
        "Errors are reported clearly without producing partial results."
      ],
      "priority": "Medium",
      "category": "Feature",
      "requirement_ids": [
        "REQ-003"
      ],
      "related_backlog_ids": [],
      "backlog_relationships": [],
      "recommended_action": "create_new"
    },
    {
      "id": "STORY-004",
      "title": "The dashboard should display current information within two minutes of a deployment event",
      "description": "As an engineering team, we want the product to satisfy this requirement: The dashboard should display current information within two minutes of a deployment event, so that the identified user or operational need is addressed.",
      "acceptance_criteria": [
        "Given the required inputs are available, when the feature is used, then it satisfies: The dashboard should display current information within two minutes of a deployment event.",
        "Errors are reported clearly without producing partial results."
      ],
      "priority": "Medium",
      "category": "DevOps",
      "requirement_ids": [
        "REQ-004"
      ],
      "related_backlog_ids": [],
      "backlog_relationships": [],
      "recommended_action": "create_new"
    },
    {
      "id": "STORY-005",
      "title": "If a data source is unavailable, the dashboard must show the source as unavailable...",
      "description": "As an engineering team, we want the product to satisfy this requirement: If a data source is unavailable, the dashboard must show the source as unavailable instead of displaying stale data as current, so that the identified user or operational need is addressed.",
      "acceptance_criteria": [
        "Given the required inputs are available, when the feature is used, then it satisfies: If a data source is unavailable, the dashboard must show the source as unavailable instead of displaying stale data as current.",
        "Errors are reported clearly without producing partial results."
      ],
      "priority": "High",
      "category": "Reliability",
      "requirement_ids": [
        "REQ-005"
      ],
      "related_backlog_ids": [],
      "backlog_relationships": [],
      "recommended_action": "create_new"
    }
  ],
  "assumptions": [],
  "review_notes": [
    "Proposal passed deterministic structure checks.",
    "AI output failed guardrails; a deterministic validated proposal was used."
  ],
  "approval_required": true,
  "tool_invocations": [
    {
      "correlation_id": "da3d271f-7388-4fcb-b070-df39efbd183b",
      "agent": "Orchestrator Agent",
      "tool": "request_inspection",
      "call_count": 1,
      "execution": "model"
    },
    {
      "correlation_id": "da3d271f-7388-4fcb-b070-df39efbd183b",
      "agent": "Requirements Analyst Agent",
      "tool": "source_reader",
      "call_count": 1,
      "execution": "model"
    },
    {
      "correlation_id": "da3d271f-7388-4fcb-b070-df39efbd183b",
      "agent": "Backlog Analyst Agent",
      "tool": "backlog_search",
      "call_count": 1,
      "execution": "model"
    },
    {
      "correlation_id": "da3d271f-7388-4fcb-b070-df39efbd183b",
      "agent": "Story Writer Agent",
      "tool": "story_context",
      "call_count": 1,
      "execution": "model"
    },
    {
      "correlation_id": "da3d271f-7388-4fcb-b070-df39efbd183b",
      "agent": "Quality Reviewer Agent",
      "tool": "proposal_validation",
      "call_count": 1,
      "execution": "model"
    }
  ]
}